{
  "id": "action:bestia:dodge",
  "name": { "ja": "回避", "en": "Dodge" },
  "actor": ["entity"],
  "params": {
    "threat": { "kind": "entity" },
    "for": { "kind": "number", "unit": "s", "range": [0.1, 2], "step": 0.1, "default": 0.1 }
  },
  "maps_to": { "custom": "dodge", "target": "$threat" },
  "pre": "1",
  "duration": "$for",
  "motion": { "kind": "sideways", "goal": "$threat", "speed": "speed(actor)" },
  "effects": [{ "at": "start", "outcomes": [{ "p": 1, "assign": [{ "var": "moved", "of": "actor", "expr": "1" }] }] }],
  "knowledge": "discoverable",
  "source": { "kind": "master", "ref": "Bestia src/behavior.cpp Task::Dodge (sidestep)" }
}
